207749386,@Kordebalet,Russia,UniverOfCountry,2025-09-15,16:13:30,0 университетов
207749386,@Kordebalet,Poland,UniverOfCountry,2025-09-15,16:13:43,137 университетов
207749386,@Kordebalet,коты,Cat Facts,2025-09-15,16:13:49,About 37% of American homes today have at least 1 cat.
207749386,@Kordebalet,Игорь,Agify.io,2025-09-15,16:13:59,Не удалось получить возраст для имени Игорь.
207749386,@Kordebalet,Oleg,Agify.io,2025-09-15,16:14:11,"Имя: Oleg Предполагаемый возраст: 55 лет На основе 11570 человек."
207749386,@Kordebalet,asdasdas,—,2025-09-15,16:14:42,"Вы написали ""asdasdas"", я не знаю такой команды."
